Category,Tool Name,Direct URL,Core AI Technology,Primary Use Case,Pricing Model,Free Quota Summary,Open Source,Tags
Specialized Dev Tools,Continue,https://continue.dev/,"LLM",Open-source IDE extension for AI code assistance.,Free,Completely Free,Yes,"IDE,Copilot,Open Source"
Specialized Dev Tools,DeepCode AI (Snyk),https://snyk.io/platform/deepcode-ai/,"Symbolic & Generative AI",Real-time code security scanning and automated fixes.,Freemium,Powerful free plan,No,"Security,Code Scan"
Specialized Dev Tools,Apidog,https://apidog.com/,"NLP",All-in-one platform for API design testing and documentation.,Freemium,Powerful free plan,No,"API,Testing,Docs"
Specialized Dev Tools,GPT Engineer,https://github.com/AntonOsika/gpt-engineer,"LLM",Generates entire codebases from a text prompt.,Free,Completely Free,Yes,"Code Generation,Agents,Open Source"
Specialized Dev Tools,Vercel AI SDK,https://sdk.vercel.ai/,"AI Development Kit",Open-source library for building AI-powered user interfaces.,Free,Completely Free,Yes,"SDK,UI,Framework,Open Source"
Specialized Dev Tools,llama.cpp,https://github.com/ggerganov/llama.cpp,"LLM Inference",High-performance inference of Llama models in C/C++.,Free,Completely Free,Yes,"LLM,Local,Performance,Open Source"
Specialized Dev Tools,automatic1111,https://github.com/AUTOMATIC1111/stable-diffusion-webui,"Diffusion Model UI",The most popular Web UI for Stable Diffusion.,Free,Completely Free,Yes,"Stable Diffusion,UI,Image,Open Source"
